<?xml version="1.0" encoding="UTF-8"?>
<datos xmlns:xsi="http://www.w3.org/2001/XMLSchema-instance" 
xsi:noNamespaceSchemaLocation="schema4_3.xsd">

    <alumno dni = "99887766X">
        <nombre>Dario</nombre>
        <apellidos> Fernandez Alvarez </apellidos>
        <nota> 3.50 </nota>
        <edad> 45 </edad>
        <comentario> Necesita mejorar </comentario>
        <calle> Comandante Vallespin </calle>
        <numero> 5 </numero>
        <ciudad> Oviedo </ciudad>
        <codigopostal> 33021 </codigopostal>
    </alumno>

    <alumno dni = "11223344A">
        <nombre>Luis</nombre>
        <apellidos> Alvarez Garcia </apellidos>
        <nota> 6.75 </nota>
        <edad> 80 </edad>
        <comentario> Copio de Dario, Alfredo y Pilar </comentario>
    </alumno>

    <alumno dni = "556677Z">
        <nombre>Pilar</nombre>
        <apellidos> Rodriguez Menendez </apellidos>
        <nota> 8.25 </nota>
        <comentario> Copio de todos </comentario>
    </alumno>

    <alumno dni = "66554433T">
        <nombre>Alfredo</nombre>
        <apellidos> Martinez Gonzalez </apellidos>
        <nota> No presentado </nota>
        <edad> 42 </edad>
        <comentario> Estudio en la Universidad de Oviedo </comentario>
        <calle> Galiana </calle>
        <numero> 23 </numero>
        <ciudad> Avil√©s </ciudad>
        <codigopostal> 33400 </codigopostal>
    </alumno>

</datos>